Microsoft Windows [Version 10.0.22631.4169]
(c) Microsoft Corporation. All rights reserved.

C:\Users\62853>cd/

C:\>cd/xampp/mysql/bin

C:\xampp\mysql\bin>mysql -u root -p
Enter password:
ERROR 2002 (HY000): Can't connect to MySQL server on 'localhost' (10061)

C:\xampp\mysql\bin>mysql -u root -p
Enter password:
Welcome to the MariaDB monitor.  Commands end with ; or \g.
Your MariaDB connection id is 8
Server version: 10.4.32-MariaDB mariadb.org binary distribution

Copyright (c) 2000, 2018, Oracle, MariaDB Corporation Ab and others.

Type 'help;' or '\h' for help. Type '\c' to clear the current input statement.

MariaDB [(none)]> create database sib7;
Query OK, 1 row affected (0.002 sec)

MariaDB [(none)]> use sib7;
Database changed

MariaDB [sib7]> show tables;
Empty set (0.007 sec)

MariaDB [sib7]> create table jenis(
    -> id int primary key auto_increment,
    -> nama varchar(30) not null unique);
affected (0.016 sec)

MariaDB [sib7]> desc jenis;
+-------+-------------+------+-----+---------+----------------+
| Field | Type        | Null | Key | Default | Extra          |
+-------+-------------+------+-----+---------+----------------+
| id    | int(11)     | NO   | PRI | NULL    | auto_increment |
| nama  | varchar(30) | NO   | UNI | NULL    |                |
+-------+-------------+------+-----+---------+----------------+
2 rows in set (0.007 sec)

MariaDB [sib7]> create table produk(
    -> id int primary key auto_increment,
    -> nama varchar(30) not null unique,
    -> harga double not null,
    -> stok int not null,
    -> jenis_id int not null references jenis(id),
    -> foto varchar(255));
Query OK, 0 rows affected (0.020 sec)

MariaDB [sib7]> alter table jenis
    -> add column keterangan text after nama;
Query OK, 0 rows affected (0.014 sec)
Records: 0  Duplicates: 0  Warnings: 0

MariaDB [sib7]> desc jenis;
+------------+-------------+------+-----+---------+----------------+
| Field      | Type        | Null | Key | Default | Extra          |
+------------+-------------+------+-----+---------+----------------+
| id         | int(11)     | NO   | PRI | NULL    | auto_increment |
| nama       | varchar(30) | NO   | UNI | NULL    |                |
| keterangan | text        | YES  |     | NULL    |                |
+------------+-------------+------+-----+---------+----------------+
3 rows in set (0.011 sec)

MariaDB [sib7]> alter table jenis change keterangan ket text;
Query OK, 0 rows affected (0.016 sec)
Records: 0  Duplicates: 0  Warnings: 0

MariaDB [sib7]> desc jenis;
+-------+-------------+------+-----+---------+----------------+
| Field | Type        | Null | Key | Default | Extra          |
+-------+-------------+------+-----+---------+----------------+
| id    | int(11)     | NO   | PRI | NULL    | auto_increment |
| nama  | varchar(30) | NO   | UNI | NULL    |                |
| ket   | text        | YES  |     | NULL    |                |
+-------+-------------+------+-----+---------+----------------+
3 rows in set (0.011 sec)

MariaDB [sib7]> alter table jenis modify ket varchar(255) after nama;
Query OK, 0 rows affected (0.052 sec)
Records: 0  Duplicates: 0  Warnings: 0

MariaDB [sib7]> desc jenis;
+-------+--------------+------+-----+---------+----------------+
| Field | Type         | Null | Key | Default | Extra          |
+-------+--------------+------+-----+---------+----------------+
| id    | int(11)      | NO   | PRI | NULL    | auto_increment |
| nama  | varchar(30)  | NO   | UNI | NULL    |                |
| ket   | varchar(255) | YES  |     | NULL    |                |
+-------+--------------+------+-----+---------+----------------+
3 rows in set (0.011 sec)

MariaDB [sib7]> alter table jenis drop column ket;
Query OK, 0 rows affected (0.014 sec)
Records: 0  Duplicates: 0  Warnings: 0

MariaDB [sib7]> desc jenis;
+-------+-------------+------+-----+---------+----------------+
| Field | Type        | Null | Key | Default | Extra          |
+-------+-------------+------+-----+---------+----------------+
| id    | int(11)     | NO   | PRI | NULL    | auto_increment |
| nama  | varchar(30) | NO   | UNI | NULL    |                |
+-------+-------------+------+-----+---------+----------------+
2 rows in set (0.011 sec)

MariaDB [sib7]> insert into jenis values
    -> ('', 'Elektronik'),
    -> ('', 'Makanan'),
    -> ('', 'Minuman'),
    -> ('', 'Furniture');
Query OK, 4 rows affected, 4 warnings (0.015 sec)
Records: 4  Duplicates: 0  Warnings: 4

MariaDB [sib7]> select * from jenis;
+----+------------+
| id | nama       |
+----+------------+
|  1 | Elektronik |
|  4 | Furniture  |
|  2 | Makanan    |
|  3 | Minuman    |
+----+------------+
4 rows in set (0.005 sec)

MariaDB [sib7]> insert into produk (nama, harga, stok, jenis_id, foto) values
    -> ('TV 21 inch', 2000000, 10, 1, 'Foto1.jpg');
Query OK, 1 row affected (0.009 sec)

MariaDB [sib7]> select * from produk;
+----+------------+---------+------+----------+-----------+
| id | nama       | harga   | stok | jenis_id | foto      |
+----+------------+---------+------+----------+-----------+
|  1 | TV 21 inch | 2000000 |   10 |        1 | Foto1.jpg |
+----+------------+---------+------+----------+-----------+
1 row in set (0.000 sec)

MariaDB [sib7]> insert into produk (nama, harga, stok, jenis_id, foto) values
    -> ('Nasi Goreng', 20000, 20, 2, 'Nasi.jpg'),
    -> ('Es Cendol', 15000, 30, 3, 'es.jpg'),
    -> ('Meja', 400000, 20, 4, 'meja.jpg'),
    -> ('Kursi', 500000, 15, 4, 'kursi.jpg');
Query OK, 4 rows affected (0.005 sec)
Records: 4  Duplicates: 0  Warnings: 0

MariaDB [sib7]> select * from produk;
+----+-------------+---------+------+----------+-----------+
| id | nama        | harga   | stok | jenis_id | foto      |
+----+-------------+---------+------+----------+-----------+
|  1 | TV 21 inch  | 2000000 |   10 |        1 | Foto1.jpg |
|  2 | Nasi Goreng |   20000 |   20 |        2 | Nasi.jpg  |
|  3 | Es Cendol   |   15000 |   30 |        3 | es.jpg    |
|  4 | Meja        |  400000 |   20 |        4 | meja.jpg  |
|  5 | Kursi       |  500000 |   15 |        4 | kursi.jpg |
+----+-------------+---------+------+----------+-----------+
5 rows in set (0.000 sec)

MariaDB [sib7]> update produk set stok = 30 where id =4;
Query OK, 1 row affected (0.007 sec)
Rows matched: 1  Changed: 1  Warnings: 0

MariaDB [sib7]> select * from produk;
+----+-------------+---------+------+----------+-----------+
| id | nama        | harga   | stok | jenis_id | foto      |
+----+-------------+---------+------+----------+-----------+
|  1 | TV 21 inch  | 2000000 |   10 |        1 | Foto1.jpg |
|  2 | Nasi Goreng |   20000 |   20 |        2 | Nasi.jpg  |
|  3 | Es Cendol   |   15000 |   30 |        3 | es.jpg    |
|  4 | Meja        |  400000 |   30 |        4 | meja.jpg  |
|  5 | Kursi       |  500000 |   15 |        4 | kursi.jpg |
+----+-------------+---------+------+----------+-----------+
5 rows in set (0.000 sec)

MariaDB [sib7]> update produk set nama='TV 21 Inch', harga=3000000 where id=1;
Query OK, 1 row affected (0.005 sec)
Rows matched: 1  Changed: 1  Warnings: 0

MariaDB [sib7]> select * from produk;
+----+-------------+---------+------+----------+-----------+
| id | nama        | harga   | stok | jenis_id | foto      |
+----+-------------+---------+------+----------+-----------+
|  1 | TV 21 Inch  | 3000000 |   10 |        1 | Foto1.jpg |
|  2 | Nasi Goreng |   20000 |   20 |        2 | Nasi.jpg  |
|  3 | Es Cendol   |   15000 |   30 |        3 | es.jpg    |
|  4 | Meja        |  400000 |   30 |        4 | meja.jpg  |
|  5 | Kursi       |  500000 |   15 |        4 | kursi.jpg |
+----+-------------+---------+------+----------+-----------+
5 rows in set (0.000 sec)

MariaDB [sib7]> delete from produk where id=5;
Query OK, 1 row affected (0.004 sec)

MariaDB [sib7]> select * from produk;
+----+-------------+---------+------+----------+-----------+
| id | nama        | harga   | stok | jenis_id | foto      |
+----+-------------+---------+------+----------+-----------+
|  1 | TV 21 Inch  | 3000000 |   10 |        1 | Foto1.jpg |
|  2 | Nasi Goreng |   20000 |   20 |        2 | Nasi.jpg  |
|  3 | Es Cendol   |   15000 |   30 |        3 | es.jpg    |
|  4 | Meja        |  400000 |   30 |        4 | meja.jpg  |
+----+-------------+---------+------+----------+-----------+
4 rows in set (0.000 sec)